{
  "schema_version": "1.6",
  "candidate_id": "dark_shard_1:1:0-33",
  "profile_id": "tol_standard_dev",
  "pass_l2": true,
  "matched_constraints": 3,
  "rmsd": 0.22,
  "score": 0.91,
  "failure_reason": null,
  "audit": ["try_profile:narrow:tol_narrow_dev", "try_profile:standard:tol_standard_dev"],
  "provenance": {
    "source": "gls-patch-realizer",
    "version": "v1.6",
    "parameters_hash": "0123456789abcdef",
    "artifact_hash": "fedcba9876543210"
  }
}
